{
  "colors": [
    "#C3DCC5",
    "#A8CFAC",
    "#90C295",
    "#76AE7C",
    "#56955C",
    "#408147"
  ],
  "title": "Population",
  "unit": "population",
  "values": [
    "0 - 10.000",
    "10.000 - 20.000",
    "20.000 - 30.000",
    "30.000 - 40.000",
    "40.000 - 50.000",
    "50.000 - 60.000"
  ]
}
